,Title,Location,Company,Salary,Description,text,lemtext
0,Business and Data Analyst,"Vaughan, ON","Alphabyte Solutions, Inc.",,"Business & Data Analyst - Alphabyte Solutions, Inc. (Vaughan, ON)
https://alphabyte.ai
About the Alphabyte Family:
Based in Toronto, Canada, Alphabyte embodies the entrepreneurial spirit of Canada’s start-up scene. For years, we have based this on the premise that with a little thoughtfulness and determination, anything can be done a little bit better, and a little bit faster.
A leader in IT and Data services, Alphabyte’s portfolios extends across North America, Europe, and Australia. A truly global corporate citizen, we are committed to responsible business practices to bring about positive change. In addition to the cool gadgets which we invent and work with, we are constantly striving to create innovative programs and resources that provide flexibility for work-life balance in order to maintain a positive working environment, as well as taking part in our communities through philanthropic efforts.
The Alphabyte Team thrives on thinking outside of the box while maintaining a commitment to our values. We ensure that we keep up with the times, and as the Data industry makes the transition from Big Data Analytics to Artificial Intelligence and Machine Learning - we ensure that we remain at the forefront of innovation. Underneath it, we are driven by an eagerness to make an impact as a team.
About the Role:
As a Business and Data Analyst, you will become an integral part of the Alphabyte team, where you will combine your Data Analysis, Business Intelligence, and Programming skills to become a cohesive link which ties together the various facets of the organization, as well as provide database support and ensure that our code-base, and our client infrastructure remains in a healthy state.
On a day to day basis, you will also be overseeing much of the Development, Quality Assurance, User Acceptance Testing, and Reporting within the organization. You will be a Guru of end-user satisfaction of Alphabyte’s Solutions and Products.
What is Required of You:
· Strategic and personable communicator
· Resourceful, creative, and team oriented
· Strong data analysis skills, ability to recognize patterns in numbers and charts
· Highly detail oriented self-starter who works well under pressure and turns complex situations into ideas, strategies and actions
· Requires minimal supervision and is able to manage through ambiguity
· Strong organizational skills, with an ability to adapt and deliver results in a fast-paced environment
· Bi-lingual in technology and business, able to communicate technical issues into business terms and vice-versa.
Knowledge and Experience:
· 5+ Years working in a fast-paced IT environment
· 3+ Years working with SQL (T-SQL, PL/SQL)
· 3+ Years working with an end-to-end Microsoft stack
· 1+ Years working with Microsoft's Azure Cloud environment
· 2+ Years managing users within AD Groups and Workspaces, ensuring the reliability of access in Outlook, SharePoint, SQL Server, Windows Servers and VM's, MS Power BI
· 3+ Years in reporting, and/or data analysis using Power BI, Tableau, or similar tools
· Basic knowledge of .NET (C#)
Skills Required
· Bachelors in Engineering, Computer Science, or a Quantitative Field such as Math/Statistics
· SQL (3+ years)
· Python
· Power BI / Tableau
Additional Consideration If you have:
· Experience working with Microsoft Data Factory
· C / C++ / Unix
· 6-Sigma Certification
· Can provide a detailed cover letter with additional “real life scenarios” where you’ve applied your skillset in a trying situation or setting
· Having great appreciation for all kinds of Coffee or Sports Trivia
Job Type: Full-time
Experience:
SQL: 3 years (Required)
Education:
Bachelor's Degree (Required)
Language:
English (Required)",business data analyst alphabyte solutions inc vaughan on https alphabyte ai about the alphabyte family based in toronto canada alphabyte embodies the entrepreneurial spirit of canada s start up scene for years we have based this on the premise that with a little thoughtfulness and determination anything can be done a little bit better and a little bit faster a leader in it and data services alphabyte s portfolios extends across north america europe and australia a truly global corporate citizen we are committed to responsible business practices to bring about positive change in addition to the cool gadgets which we invent and work with we are constantly striving to create innovative programs and resources that provide flexibility for work life balance in order to maintain a positive working environment as well as taking part in our communities through philanthropic efforts the alphabyte team thrives on thinking outside of the box while maintaining a commitment to our values we ensure that we keep up with the times and as the data industry makes the transition from big data analytics to artificial intelligence and machine learning we ensure that we remain at the forefront of innovation underneath it we are driven by an eagerness to make an impact as a team about the role as a business and data analyst you will become an integral part of the alphabyte team where you will combine your data analysis business intelligence and programming skills to become a cohesive link which ties together the various facets of the organization as well as provide database support and ensure that our code base and our client infrastructure remains in a healthy state on a day to day basis you will also be overseeing much of the development quality assurance user acceptance testing and reporting within the organization you will be a guru of end user satisfaction of alphabyte s solutions and products what is required of you strategic and personable communicator resourceful creative and team oriented strong data analysis skills ability to recognize patterns in numbers and charts highly detail oriented self starter who works well under pressure and turns complex situations into ideas strategies and actions requires minimal supervision and is able to manage through ambiguity strong organizational skills with an ability to adapt and deliver results in a fast paced environment bi lingual in technology and business able to communicate technical issues into business terms and vice versa knowledge and experience years working in a fast paced it environment years working with sql t sql pl sql years working with an end to end microsoft stack years working with microsoft s azure cloud environment years managing users within ad groups and workspaces ensuring the reliability of access in outlook sharepoint sql server windows servers and vm s ms power bi years in reporting and or data analysis using power bi tableau or similar tools basic knowledge of net c skills required bachelors in engineering computer science or a quantitative field such as math statistics sql years python power bi tableau additional consideration if you have experience working with microsoft data factory c c unix sigma certification can provide a detailed cover letter with additional real life scenarios where you ve applied your skillset in a trying situation or setting having great appreciation for all kinds of coffee or sports trivia job type full time experience sql years required education bachelor s degree required language english required ,business data analyst alphabyte solution inc vaughan http alphabyte ai alphabyte family based toronto canada alphabyte embodies entrepreneurial spirit canada start scene year based premise little thoughtfulness determination anything done little bit better little bit faster leader data service alphabyte portfolio extends across north america europe australia truly global corporate citizen committed responsible business practice bring positive change addition cool gadget invent work constantly striving create innovative program resource provide flexibility work life balance order maintain positive working environment well taking part community philanthropic effort alphabyte team thrives thinking outside box maintaining commitment value ensure keep time data industry make transition big data analytics artificial intelligence machine learning ensure remain forefront innovation underneath driven eagerness make impact team role business data analyst become integral part alphabyte team combine data analysis business intelligence programming skill become cohesive link tie together various facet organization well provide database support ensure code base client infrastructure remains healthy state day day basis also overseeing much development quality assurance user acceptance testing reporting within organization guru end user satisfaction alphabyte solution product required strategic personable communicator resourceful creative team oriented strong data analysis skill ability recognize pattern number chart highly detail oriented self starter work well pressure turn complex situation idea strategy action requires minimal supervision able manage ambiguity strong organizational skill ability adapt deliver result fast paced environment bi lingual technology business able communicate technical issue business term vice versa knowledge experience year working fast paced environment year working sql sql pl sql year working end end microsoft stack year working microsoft azure cloud environment year managing user within ad group workspace ensuring reliability access outlook sharepoint sql server window server vm m power bi year reporting data analysis using power bi tableau similar tool basic knowledge net c skill required bachelor engineering computer science quantitative field math statistic sql year python power bi tableau additional consideration experience working microsoft data factory c c unix sigma certification provide detailed cover letter additional real life scenario applied skillset trying situation setting great appreciation kind coffee sport trivia job type full time experience sql year required education bachelor degree required language english required 
1,Data Analyst,"Toronto, ON",University of Toronto,"$78,307 a year","Position Summary: Under the direction of the Assessment Librarian, the Data Analyst is responsible for providing technical support and operational oversight for the analysis and visualization of library data. The Data Analyst works with librarians and staff across the University of Toronto libraries to gather, standardize, analyze and visualize data to meet external reporting and accountability requirements and to support library initiatives and planning. Extracts, transforms, manipulates, converts and reports on data and statistics. Creates dashboards for various data collections and projects. Maintains and updates data inventories.

Qualifications:
(Minimum)
Education:
Bachelor’s degree in Computer or Data Science or acceptable combination of education & experience.

Experience:
Three years of related experience.
Experience working with Tableau or equivalent data visualization tool.
Strong working knowledge of relational databases and query structure. Experience writing scripts in R, Python, PHP and/or Java Script.
Experience using APIs to retrieve and parse data.
Experience coding in at least one language.
One or more years of data modelling and database schema experience.
Demonstrated experience using Excel and), database management tools (e.g. Access, SQL); Internet, and presentation packages (Power Point).
Ability to work independently and in a team. Excellent analytical, organizational, and interpersonal skills.
Effective communication skills, including the ability to clearly and concisely express complex concepts in simple terms and communicate technical information to non-technical staff.
Demonstrated skill and experience in data manipulation, management, and analysis.
Knowledge of project management principles and experience completing complex projects within timelines.
Other Skills:
Accuracy, attention to detail and ability to break complex projects into a logical sequence of tasks.
Familiarity with statistical principles, especially descriptive statistics.
Knowledge, training or experience in data visualization best practices.
Demonstrated ability in project planning and design using considerable judgment, initiative, and innovation in decision-making.
Experience working in a higher-education setting.
Demonstrated interest in Data Science


Travel: None",position summary under the direction of the assessment librarian the data analyst is responsible for providing technical support and operational oversight for the analysis and visualization of library data the data analyst works with librarians and staff across the university of toronto libraries to gather standardize analyze and visualize data to meet external reporting and accountability requirements and to support library initiatives and planning extracts transforms manipulates converts and reports on data and statistics creates dashboards for various data collections and projects maintains and updates data inventories qualifications minimum education bachelor s degree in computer or data science or acceptable combination of education experience experience three years of related experience experience working with tableau or equivalent data visualization tool strong working knowledge of relational databases and query structure experience writing scripts in r python php and or java script experience using apis to retrieve and parse data experience coding in at least one language one or more years of data modelling and database schema experience demonstrated experience using excel and database management tools e g access sql internet and presentation packages power point ability to work independently and in a team excellent analytical organizational and interpersonal skills effective communication skills including the ability to clearly and concisely express complex concepts in simple terms and communicate technical information to non technical staff demonstrated skill and experience in data manipulation management and analysis knowledge of project management principles and experience completing complex projects within timelines other skills accuracy attention to detail and ability to break complex projects into a logical sequence of tasks familiarity with statistical principles especially descriptive statistics knowledge training or experience in data visualization best practices demonstrated ability in project planning and design using considerable judgment initiative and innovation in decision making experience working in a higher education setting demonstrated interest in data science travel none,position summary direction assessment librarian data analyst responsible providing technical support operational oversight analysis visualization library data data analyst work librarian staff across university toronto library gather standardize analyze visualize data meet external reporting accountability requirement support library initiative planning extract transforms manipulates convert report data statistic creates dashboard various data collection project maintains update data inventory qualification minimum education bachelor degree computer data science acceptable combination education experience experience three year related experience experience working tableau equivalent data visualization tool strong working knowledge relational database query structure experience writing script r python php java script experience using apis retrieve parse data experience coding least one language one year data modelling database schema experience demonstrated experience using excel database management tool e g access sql internet presentation package power point ability work independently team excellent analytical organizational interpersonal skill effective communication skill including ability clearly concisely express complex concept simple term communicate technical information non technical staff demonstrated skill experience data manipulation management analysis knowledge project management principle experience completing complex project within timeline skill accuracy attention detail ability break complex project logical sequence task familiarity statistical principle especially descriptive statistic knowledge training experience data visualization best practice demonstrated ability project planning design using considerable judgment initiative innovation decision making experience working higher education setting demonstrated interest data science travel none 
