,Title,Location,Company,Salary,Description,text,lemtext
46,Data & Reporting Sr Business Analyst (AVP level),"Mississauga, ON",CITI,,"The IT Business Senior Analyst is responsible for liaising between business users and technologists to exchange information in a concise, logical and understandable way in coordination with the Technology team. The overall objective of this role is to contribute to continuous iterative exploration and investigation of business performance and other measures to gain insight and drive business planning.

Responsibilities:
Formulate and define systems scope and objectives for complex projects and foster communication between business leaders and IT
Consult with users and clients to solve complex system issues/problems through in-depth evaluation of business processes, systems and industry standards and recommends solutions
Support system change processes from requirements through implementation and provide input based on analysis of information
Consult with business clients to determine system functional specifications and provides user and operational support
Identify and communicate risks and impacts, considering business implications of the application of technology to the current business environment
Act as advisor or coach to new or lower level analysts and work as a team to achieve business objectives, performing other duties and functions as assigned
Appropriately assess risk when business decisions are made, demonstrating particular consideration for the firm's reputation and safeguarding Citigroup, its clients and assets, by driving compliance with applicable laws, rules and regulations, adhering to Policy, applying sound ethical judgment regarding personal behavior, conduct and business practices, and escalating, managing and reporting control issues with transparency.
Qualifications:
5-8 years of relevant experience
Experience in data analysis with intermediate/advanced Microsoft Office Suite skills
Proven interpersonal, data analysis, diplomatic, management and prioritization skills
Consistently demonstrate clear and concise written and verbal communication
Proven ability to manage multiple activities and build/develop working relationships
Proven self-motivation to take initiative and master new tasks quickly
Demonstrated ability to work under pressure to meet tight deadlines and approach work methodically with attention to detail
Education:
Bachelor's degree/University degree or equivalent experience
Responsibilities:
Consult with business clients to determine system functional specifications and partner with multiple teams and other units to meet organizational objectives
Provide input during development and implementation phases, including formulation and definition of scope, objectives and system enhancements for complex, high-impact projects
Evaluate evolving business requirements and recommend appropriate enhancements.
Work with global BA and Dev teams to perform data analysis. Basic knowledge of data modeling is a must
Provide in-depth and sophisticated analyses with interpretive thinking to define problems, develop innovative solutions and influence strategic functional decisions
Collaborate with developers to translate business requirements into technically feasible and efficient solutions and transition requirements to QA team and assist in test scenario development
Oversee project deliveries to ensure they remain on track and communicate risks and impacts and propose risk mitigation options, considering business implications of the application of technology to the current business environment
Appropriately assess risk when business decisions are made, demonstrating particular consideration for the firm's reputation and safeguarding Citigroup, its clients and assets, by driving compliance with applicable laws, rules and regulations, adhering to Policy, applying sound ethical judgment regarding personal behavior, conduct and business practices, and escalating, managing and reporting control issues with transparency.
We highly encourage you to apply if you have the below demonstrated experience:
Requirements Gathering and Documentation
Good understanding of Trade Data Flow Processing
Business Intelligence and Data Visualization
Statistical & Business Analysis
Data Transformation and Big Data Migration
JIRA, Confluence, SQL
Stakeholder experience at varying levels
Project Management
Additional Qualifications:
5+ years of experience
Proficiency in MS Office (Word, Excel, Visio, PowerPoint) with extensive experience using Excel for data analysis
Experience with all phases of Software Development Life Cycle
Understanding of Data Modeling and ER model
Comprehensive knowledge of the principles of business analysis
Functional knowledge of Fixed Income trading flows
Experience writing SQL and analyzing and producing data models
Prior experience working with front office stakeholders (Traders, Quants, Bankers ) or finance/product control teams
Ability to create presentations for senior management provide input on overall product roadmap and strategy
Citi Canada is an equal opportunity employer. Accordingly, we will make accommodations to respond to the needs of people with disabilities (including, without limitation, physical and mental health disabilities) during the recruitment process and otherwise in accordance with law. Individuals who view themselves as Aboriginals, members of visible minority or racialized communities, and people with disabilities are encouraged to apply.
-
Grade :All Job Level - All Job FunctionsAll Job Level - All Job Functions - CA
-
Time Type :
-
Citi is an equal opportunity and affirmative action employer.
Minority/Female/Veteran/Individuals with Disabilities/Sexual Orientation/Gender Identity.
Citigroup Inc. and its subsidiaries (""Citi”) invite all qualified interested applicants to apply for career opportunities. If you are a person with a disability and need a reasonable accommodation to use our search tools and/or apply for a career opportunity .
To view the ""EEO is the Law"" poster . To view the EEO is the Law Supplement .
To view the EEO Policy Statement .
To view the Pay Transparency Posting .",the it business senior analyst is responsible for liaising between business users and technologists to exchange information in a concise logical and understandable way in coordination with the technology team the overall objective of this role is to contribute to continuous iterative exploration and investigation of business performance and other measures to gain insight and drive business planning responsibilities formulate and define systems scope and objectives for complex projects and foster communication between business leaders and it consult with users and clients to solve complex system issues problems through in depth evaluation of business processes systems and industry standards and recommends solutions support system change processes from requirements through implementation and provide input based on analysis of information consult with business clients to determine system functional specifications and provides user and operational support identify and communicate risks and impacts considering business implications of the application of technology to the current business environment act as advisor or coach to new or lower level analysts and work as a team to achieve business objectives performing other duties and functions as assigned appropriately assess risk when business decisions are made demonstrating particular consideration for the firm s reputation and safeguarding citigroup its clients and assets by driving compliance with applicable laws rules and regulations adhering to policy applying sound ethical judgment regarding personal behavior conduct and business practices and escalating managing and reporting control issues with transparency qualifications years of relevant experience experience in data analysis with intermediate advanced microsoft office suite skills proven interpersonal data analysis diplomatic management and prioritization skills consistently demonstrate clear and concise written and verbal communication proven ability to manage multiple activities and build develop working relationships proven self motivation to take initiative and master new tasks quickly demonstrated ability to work under pressure to meet tight deadlines and approach work methodically with attention to detail education bachelor s degree university degree or equivalent experience responsibilities consult with business clients to determine system functional specifications and partner with multiple teams and other units to meet organizational objectives provide input during development and implementation phases including formulation and definition of scope objectives and system enhancements for complex high impact projects evaluate evolving business requirements and recommend appropriate enhancements work with global ba and dev teams to perform data analysis basic knowledge of data modeling is a must provide in depth and sophisticated analyses with interpretive thinking to define problems develop innovative solutions and influence strategic functional decisions collaborate with developers to translate business requirements into technically feasible and efficient solutions and transition requirements to qa team and assist in test scenario development oversee project deliveries to ensure they remain on track and communicate risks and impacts and propose risk mitigation options considering business implications of the application of technology to the current business environment appropriately assess risk when business decisions are made demonstrating particular consideration for the firm s reputation and safeguarding citigroup its clients and assets by driving compliance with applicable laws rules and regulations adhering to policy applying sound ethical judgment regarding personal behavior conduct and business practices and escalating managing and reporting control issues with transparency we highly encourage you to apply if you have the below demonstrated experience requirements gathering and documentation good understanding of trade data flow processing business intelligence and data visualization statistical business analysis data transformation and big data migration jira confluence sql stakeholder experience at varying levels project management additional qualifications years of experience proficiency in ms office word excel visio powerpoint with extensive experience using excel for data analysis experience with all phases of software development life cycle understanding of data modeling and er model comprehensive knowledge of the principles of business analysis functional knowledge of fixed income trading flows experience writing sql and analyzing and producing data models prior experience working with front office stakeholders traders quants bankers or finance product control teams ability to create presentations for senior management provide input on overall product roadmap and strategy citi canada is an equal opportunity employer accordingly we will make accommodations to respond to the needs of people with disabilities including without limitation physical and mental health disabilities during the recruitment process and otherwise in accordance with law individuals who view themselves as aboriginals members of visible minority or racialized communities and people with disabilities are encouraged to apply grade all job level all job functionsall job level all job functions ca time type citi is an equal opportunity and affirmative action employer minority female veteran individuals with disabilities sexual orientation gender identity citigroup inc and its subsidiaries citi invite all qualified interested applicants to apply for career opportunities if you are a person with a disability and need a reasonable accommodation to use our search tools and or apply for a career opportunity to view the eeo is the law poster to view the eeo is the law supplement to view the eeo policy statement to view the pay transparency posting ,business senior analyst responsible liaising business user technologist exchange information concise logical understandable way coordination technology team overall objective role contribute continuous iterative exploration investigation business performance measure gain insight drive business planning responsibility formulate define system scope objective complex project foster communication business leader consult user client solve complex system issue problem depth evaluation business process system industry standard recommends solution support system change process requirement implementation provide input based analysis information consult business client determine system functional specification provides user operational support identify communicate risk impact considering business implication application technology current business environment act advisor coach new lower level analyst work team achieve business objective performing duty function assigned appropriately ass risk business decision made demonstrating particular consideration firm reputation safeguarding citigroup client asset driving compliance applicable law rule regulation adhering policy applying sound ethical judgment regarding personal behavior conduct business practice escalating managing reporting control issue transparency qualification year relevant experience experience data analysis intermediate advanced microsoft office suite skill proven interpersonal data analysis diplomatic management prioritization skill consistently demonstrate clear concise written verbal communication proven ability manage multiple activity build develop working relationship proven self motivation take initiative master new task quickly demonstrated ability work pressure meet tight deadline approach work methodically attention detail education bachelor degree university degree equivalent experience responsibility consult business client determine system functional specification partner multiple team unit meet organizational objective provide input development implementation phase including formulation definition scope objective system enhancement complex high impact project evaluate evolving business requirement recommend appropriate enhancement work global ba dev team perform data analysis basic knowledge data modeling must provide depth sophisticated analysis interpretive thinking define problem develop innovative solution influence strategic functional decision collaborate developer translate business requirement technically feasible efficient solution transition requirement qa team assist test scenario development oversee project delivery ensure remain track communicate risk impact propose risk mitigation option considering business implication application technology current business environment appropriately ass risk business decision made demonstrating particular consideration firm reputation safeguarding citigroup client asset driving compliance applicable law rule regulation adhering policy applying sound ethical judgment regarding personal behavior conduct business practice escalating managing reporting control issue transparency highly encourage apply demonstrated experience requirement gathering documentation good understanding trade data flow processing business intelligence data visualization statistical business analysis data transformation big data migration jira confluence sql stakeholder experience varying level project management additional qualification year experience proficiency m office word excel visio powerpoint extensive experience using excel data analysis experience phase software development life cycle understanding data modeling er model comprehensive knowledge principle business analysis functional knowledge fixed income trading flow experience writing sql analyzing producing data model prior experience working front office stakeholder trader quants banker finance product control team ability create presentation senior management provide input overall product roadmap strategy citi canada equal opportunity employer accordingly make accommodation respond need people disability including without limitation physical mental health disability recruitment process otherwise accordance law individual view aboriginal member visible minority racialized community people disability encouraged apply grade job level job functionsall job level job function ca time type citi equal opportunity affirmative action employer minority female veteran individual disability sexual orientation gender identity citigroup inc subsidiary citi invite qualified interested applicant apply career opportunity person disability need reasonable accommodation use search tool apply career opportunity view eeo law poster view eeo law supplement view eeo policy statement view pay transparency posting 
