,Title,Location,Company,Salary,Description,text,lemtext
17,Data Solution Analyst II,"Toronto, ON",Invesco,,"Invesco is one of the world’s leading global investment managers, entrusted with managing $1.2 trillion* in assets on behalf of clients worldwide. We are the 6th largest US retail asset manager and the 13th largest investment manager globally, and our more than 8,000 employees worldwide are dedicated to delivering an investment experience that helps people get more out of life. We are purely focused on managing a comprehensive range of active, passive and alternative investment capabilities, which we draw on to provide customized solutions aligned to client needs, our most important benchmark. (*As of May 31,2019)

Job Purpose (Job Summary):
The role of Data Solution Analyst is to provide data quality solutions to Invesco’s internal clients globally. The candidate will work closely with other IS teams such as GIDS, GPS, GPRS to manage all aspects of data mastering and quality process development and support initiatives – across asset classes and geographies. The candidate will work within a global team of up to ten resources to execute against initiatives; including liaising and working jointly with GIDS and GPS team members and Technology department in global locations to provide 7x24 coverage to business stakeholders. The Data Solution team will work in conjunction with Technology teams and other key stakeholders to deliver data solutions using data enterprise management tools. This role will work with data owners, data stewards, data custodians and data consumers as the subject matter r expert on Securities reference data related topics. Other responsibilities include performing research/analysis, facilitate discussions with business partners and document outcome. The primary responsibility of the incumbent is to develop and maintain a robust stable Enterprise Data Management (EDM) platform contributing to the delivery of “a superior investment experience”.

Key Responsibilities / Duties:
Process design and implementation:
Execute workflow design build as set by senior members of Data Solutions
Assist in gathering business requirements for ongoing Markit EDM enhancements
Interpret and execute functional technical workflow requirements for EDM development
Review requirements with relevant stakeholders to obtain agreement and sign off of proposals
Assist in Build automated data master/quality solutions and Web user Interfaces on EDM platforms
Perform Quality Assurance checks on new EDM system workflows before implementation.
Update EDM design, data dictionary and process documentation.
System Integrity:
Monitor and report system issues to the team for review and resolution
Run test cases for Markit EDM system and application upgrade and enhancement
Work with IT technical support team to resolve Markit EDM hardware / application Production issues
Projects and Business support:
Participate in Data Solutions Projects and Data Solutions work streams of cross functional projects as assigned
Provide first-line support for relevant data projects and data enquires
Ensure support requests are handled promptly and accurately
Create and maintain scheduled reports for internal business partners
Participate in the implementation of scheduled Markit EDM process enhancement releases
Co-ordinate end user testing of EDM enhancement releases
Work closely with the other business units in GIDS and IS business units to execute other Data initiatives
Work Experience / Knowledge:
Prior experience with Markit EDM application preferred
Strong knowledge of SQL, SQL server database
Basic understanding of the end-to-end data flow/process design
Has a broad understanding of Investment operations as well as technology and its applications
Minimum 2 years of Investment industry experience in either an IT or Investment Operations role
Strong Microsoft Office skills – in particular Excel, Access, Word, PowerPoint, Project and Visio
Prior work experience with other EDM applications (e.g. Eagle,Informatica) an asset
Ability to work effectively in a virtual environment that require frequent interaction with global colleagues with cultural diversity
Skills / Other Personal Attributes Required:
Facilitate collaboration within a team
Strong interpersonal skills necessary to effectively communicate over the phone with a variety of individuals at all levels and diverse business background in a confident and engaging manner
Strong analytical and problem solving skills
Open minded, flexible, and willing to listen to and incorporate other people’s opinions and a strong “out-of-the-box” thinker who challenges status-quo
Customer focus and with a keen interest in providing superb services to clients
Strong organization skills, detail oriented, with an ability to understand the big picture
Research & analytical as well as problem solving skills
A team player with the ability to think on the feet and scenario plan
Able to work well under pressure and meeting tight deadlines
Formal Education: (minimum requirement to perform job duties)
A Bachelor’s in IT, Finance is required or an equivalent combination of education, training and experience that would provide the knowledge, skills and ability required
License/Registration/Certification: (minimum requirement to perform job duties)
CFA preferred but not required.
Canadian Securities Course (CSC) certificate or an equivalent combination of education, training and experience to fulfill the job criteria; Professional accounting designation (CMA, CGA or CA) or CFA an asset
Working Conditions:
Normal office environment with little exposure to excessive noise, dust and temperature.
May be required to lift, carry, or move weights of up to 10 pounds.
Frequent sitting and visual concentration is also required
Provide off-hour on call support as needed
Travel may be required

The above information on this description has been designed to indicate the general nature and level of work performed by employees within this role. It is not designed to contain or be interpreted as a comprehensive inventory of all duties, responsibilities and qualifications required of employees assigned to this job. The job holder may be required to perform other duties as deemed appropriate by their manager from time to time.

Invesco is committed to fair and accessible employment practices. If selected for an interview, we will work with you to ensure that your interview is accessible and accommodation is provided. Please contact us at accessibility@invesco.ca or 1.800.874.6275 to let us know if you require accommodation for an interview due to a disability.",invesco is one of the world s leading global investment managers entrusted with managing trillion in assets on behalf of clients worldwide we are the th largest us retail asset manager and the th largest investment manager globally and our more than employees worldwide are dedicated to delivering an investment experience that helps people get more out of life we are purely focused on managing a comprehensive range of active passive and alternative investment capabilities which we draw on to provide customized solutions aligned to client needs our most important benchmark as of may job purpose job summary the role of data solution analyst is to provide data quality solutions to invesco s internal clients globally the candidate will work closely with other is teams such as gids gps gprs to manage all aspects of data mastering and quality process development and support initiatives across asset classes and geographies the candidate will work within a global team of up to ten resources to execute against initiatives including liaising and working jointly with gids and gps team members and technology department in global locations to provide x coverage to business stakeholders the data solution team will work in conjunction with technology teams and other key stakeholders to deliver data solutions using data enterprise management tools this role will work with data owners data stewards data custodians and data consumers as the subject matter r expert on securities reference data related topics other responsibilities include performing research analysis facilitate discussions with business partners and document outcome the primary responsibility of the incumbent is to develop and maintain a robust stable enterprise data management edm platform contributing to the delivery of a superior investment experience key responsibilities duties process design and implementation execute workflow design build as set by senior members of data solutions assist in gathering business requirements for ongoing markit edm enhancements interpret and execute functional technical workflow requirements for edm development review requirements with relevant stakeholders to obtain agreement and sign off of proposals assist in build automated data master quality solutions and web user interfaces on edm platforms perform quality assurance checks on new edm system workflows before implementation update edm design data dictionary and process documentation system integrity monitor and report system issues to the team for review and resolution run test cases for markit edm system and application upgrade and enhancement work with it technical support team to resolve markit edm hardware application production issues projects and business support participate in data solutions projects and data solutions work streams of cross functional projects as assigned provide first line support for relevant data projects and data enquires ensure support requests are handled promptly and accurately create and maintain scheduled reports for internal business partners participate in the implementation of scheduled markit edm process enhancement releases co ordinate end user testing of edm enhancement releases work closely with the other business units in gids and is business units to execute other data initiatives work experience knowledge prior experience with markit edm application preferred strong knowledge of sql sql server database basic understanding of the end to end data flow process design has a broad understanding of investment operations as well as technology and its applications minimum years of investment industry experience in either an it or investment operations role strong microsoft office skills in particular excel access word powerpoint project and visio prior work experience with other edm applications e g eagle informatica an asset ability to work effectively in a virtual environment that require frequent interaction with global colleagues with cultural diversity skills other personal attributes required facilitate collaboration within a team strong interpersonal skills necessary to effectively communicate over the phone with a variety of individuals at all levels and diverse business background in a confident and engaging manner strong analytical and problem solving skills open minded flexible and willing to listen to and incorporate other people s opinions and a strong out of the box thinker who challenges status quo customer focus and with a keen interest in providing superb services to clients strong organization skills detail oriented with an ability to understand the big picture research analytical as well as problem solving skills a team player with the ability to think on the feet and scenario plan able to work well under pressure and meeting tight deadlines formal education minimum requirement to perform job duties a bachelor s in it finance is required or an equivalent combination of education training and experience that would provide the knowledge skills and ability required license registration certification minimum requirement to perform job duties cfa preferred but not required canadian securities course csc certificate or an equivalent combination of education training and experience to fulfill the job criteria professional accounting designation cma cga or ca or cfa an asset working conditions normal office environment with little exposure to excessive noise dust and temperature may be required to lift carry or move weights of up to pounds frequent sitting and visual concentration is also required provide off hour on call support as needed travel may be required the above information on this description has been designed to indicate the general nature and level of work performed by employees within this role it is not designed to contain or be interpreted as a comprehensive inventory of all duties responsibilities and qualifications required of employees assigned to this job the job holder may be required to perform other duties as deemed appropriate by their manager from time to time invesco is committed to fair and accessible employment practices if selected for an interview we will work with you to ensure that your interview is accessible and accommodation is provided please contact us at accessibility invesco ca or to let us know if you require accommodation for an interview due to a disability ,invesco one world leading global investment manager entrusted managing trillion asset behalf client worldwide th largest u retail asset manager th largest investment manager globally employee worldwide dedicated delivering investment experience help people get life purely focused managing comprehensive range active passive alternative investment capability draw provide customized solution aligned client need important benchmark may job purpose job summary role data solution analyst provide data quality solution invesco internal client globally candidate work closely team gids gps gprs manage aspect data mastering quality process development support initiative across asset class geography candidate work within global team ten resource execute initiative including liaising working jointly gids gps team member technology department global location provide x coverage business stakeholder data solution team work conjunction technology team key stakeholder deliver data solution using data enterprise management tool role work data owner data steward data custodian data consumer subject matter r expert security reference data related topic responsibility include performing research analysis facilitate discussion business partner document outcome primary responsibility incumbent develop maintain robust stable enterprise data management edm platform contributing delivery superior investment experience key responsibility duty process design implementation execute workflow design build set senior member data solution assist gathering business requirement ongoing markit edm enhancement interpret execute functional technical workflow requirement edm development review requirement relevant stakeholder obtain agreement sign proposal assist build automated data master quality solution web user interface edm platform perform quality assurance check new edm system workflow implementation update edm design data dictionary process documentation system integrity monitor report system issue team review resolution run test case markit edm system application upgrade enhancement work technical support team resolve markit edm hardware application production issue project business support participate data solution project data solution work stream cross functional project assigned provide first line support relevant data project data enquires ensure support request handled promptly accurately create maintain scheduled report internal business partner participate implementation scheduled markit edm process enhancement release co ordinate end user testing edm enhancement release work closely business unit gids business unit execute data initiative work experience knowledge prior experience markit edm application preferred strong knowledge sql sql server database basic understanding end end data flow process design broad understanding investment operation well technology application minimum year investment industry experience either investment operation role strong microsoft office skill particular excel access word powerpoint project visio prior work experience edm application e g eagle informatica asset ability work effectively virtual environment require frequent interaction global colleague cultural diversity skill personal attribute required facilitate collaboration within team strong interpersonal skill necessary effectively communicate phone variety individual level diverse business background confident engaging manner strong analytical problem solving skill open minded flexible willing listen incorporate people opinion strong box thinker challenge status quo customer focus keen interest providing superb service client strong organization skill detail oriented ability understand big picture research analytical well problem solving skill team player ability think foot scenario plan able work well pressure meeting tight deadline formal education minimum requirement perform job duty bachelor finance required equivalent combination education training experience would provide knowledge skill ability required license registration certification minimum requirement perform job duty cfa preferred required canadian security course csc certificate equivalent combination education training experience fulfill job criterion professional accounting designation cma cga ca cfa asset working condition normal office environment little exposure excessive noise dust temperature may required lift carry move weight pound frequent sitting visual concentration also required provide hour call support needed travel may required information description designed indicate general nature level work performed employee within role designed contain interpreted comprehensive inventory duty responsibility qualification required employee assigned job job holder may required perform duty deemed appropriate manager time time invesco committed fair accessible employment practice selected interview work ensure interview accessible accommodation provided please contact u accessibility invesco ca let u know require accommodation interview due disability 
