,Title,Location,Company,Salary,Description,text,lemtext
34,Data Analyst - RBC Ventures (Ampli),"Toronto, ON",RBC,,"RBC Ventures is new kind of organization – one that marries the strength of one of the world’s most trusted and successful financial institutions with a mission to reimagine the role we play in people’s lives. We are building a world class team focused on creating new experiences, exploring new business models and developing new relationships that add value to how people live and work.

What is the opportunity?
Are you a creative thinker that is interested in using data to solve business problems? Does working on something completely new excite you? If so, we would like to hear from you.
RBC is reimaging the role we play in our clients’ lives. We are creating dedicated “reimagine” teams which will operate separately from the core banking business. These teams will operate in a completely agile environment where they will be able to create new capabilities, explore new business models and develop partnerships to help differentiate RBC.

As part of this process, RBC has partnered with WestJet to bring a brand new loyalty business, called Ampli, to the Canadian market. RBC is looking to hire a Data Analytics & Data Scientist, Ampli, to work with us to build the business.

In this role, you must be comfortable wearing multiple hats with a focus on building a customer support structure that will delight our members. You will collaborate with multiple teammates within the operations function to ensure proper controls are in place and the right metrics are effectively tracked. Interaction with the Ampli member base will be a key component of the role in the form of answering inquiries and resolving issues.

What will you do?
You bear the responsibility for actively managing the data & analytics pipeline within a new business venture. You will engage in activities around:

Product Analytics
Build-out baseline analytics reporting across our existing products & features to help answer common/general questions
Define & build complex SQL queries & reports for new products & features that drive value in product roadmap development
Develop highly effective analytical products such as marketing segmentations, churn analysis, member profiles deep dives, etc. that will enable the business to set strategic direction on client profiles

Partner Analytics / Campaign Monitoring
Work cross-functionally with strategic partnership teams including merchant partners to understand and develop key metrics for partnerships and programs expected from both partners including marketing ROI and contributable sale driven by Offers program and marketing campaigns
Obtain and define data elements and to deliver self-serve dashboards within time requirements for ongoing reporting packages and business development support

Modelling
Identify, manage, analyze, and interpret data to support the creation of meaningful and actionable insights that tie directly to our internal or external partners’ business objectives.
Provide Analytic subject matter expertise to define data driven client strategies including:
Utilize experimental design and post mortem analytics as new campaigns / programs are developed for partners
Provide recommended strategies supported by analytics
Design, develop and maintain predictive and segmentation models, including data acquisition, testing, validation, deployment and refinement of these models
Utilize machine learning and other advanced data tools to solve business problems

What do you need to succeed?
Must have:
Curious mind with a desire to solve problems with data
Strong analytical skills with the ability to interpret complex data and make data-based strategic decisions
Solid technical skills with expertise with statistical analysis, SQL, R, Python, machine learning and data visualization tools
Understanding and experience building segmentation and predictive models
Strong interpersonal skills with ability to make and defend recommendations including creatively finding solutions to address multiple stakeholder needs
Ability to work under pressure, focus on priorities and multi-task
Independent, self-directed
Comfortable dealing with incomplete information, uncertainty and change

Nice to have:
Experience and success in both small startup environments and large matrix organizations
Experience with a 2-sided marketplace, for example merchants and consumers

What’s in it for you?
We are building something completely new in a dynamically changing industry. It’s never been done before. You have the opportunity to leverage the significant resources of our business and brand to make that change happen in the real world.

A comprehensive Total Rewards Program including bonuses and flexible benefits
Leaders who support your development through coaching and managing opportunities
Ability to make a difference and lasting impact
Work in an agile, collaborative, progressive, and high-performing team
The opportunity to interface with senior level executives from many different parts of the organization

RBCVentures

JOB SUMMARY
City: Toronto
Address: 20 Bay Street, 17th Floor
Work Hours/Week: 37.5
Work Environment: Office
Employment Type: Permanent
Career Level: Experienced Hire/Professional
Pay Type: Salary + Variable Bonus
Position Level: PL08
Required Travel (%): 0-25
Exempt/Non-Exempt: N/A
People Manager: No
Application Deadline: 03/12/2020
Req ID: 230424",rbc ventures is new kind of organization one that marries the strength of one of the world s most trusted and successful financial institutions with a mission to reimagine the role we play in people s lives we are building a world class team focused on creating new experiences exploring new business models and developing new relationships that add value to how people live and work what is the opportunity are you a creative thinker that is interested in using data to solve business problems does working on something completely new excite you if so we would like to hear from you rbc is reimaging the role we play in our clients lives we are creating dedicated reimagine teams which will operate separately from the core banking business these teams will operate in a completely agile environment where they will be able to create new capabilities explore new business models and develop partnerships to help differentiate rbc as part of this process rbc has partnered with westjet to bring a brand new loyalty business called ampli to the canadian market rbc is looking to hire a data analytics data scientist ampli to work with us to build the business in this role you must be comfortable wearing multiple hats with a focus on building a customer support structure that will delight our members you will collaborate with multiple teammates within the operations function to ensure proper controls are in place and the right metrics are effectively tracked interaction with the ampli member base will be a key component of the role in the form of answering inquiries and resolving issues what will you do you bear the responsibility for actively managing the data analytics pipeline within a new business venture you will engage in activities around product analytics build out baseline analytics reporting across our existing products features to help answer common general questions define build complex sql queries reports for new products features that drive value in product roadmap development develop highly effective analytical products such as marketing segmentations churn analysis member profiles deep dives etc that will enable the business to set strategic direction on client profiles partner analytics campaign monitoring work cross functionally with strategic partnership teams including merchant partners to understand and develop key metrics for partnerships and programs expected from both partners including marketing roi and contributable sale driven by offers program and marketing campaigns obtain and define data elements and to deliver self serve dashboards within time requirements for ongoing reporting packages and business development support modelling identify manage analyze and interpret data to support the creation of meaningful and actionable insights that tie directly to our internal or external partners business objectives provide analytic subject matter expertise to define data driven client strategies including utilize experimental design and post mortem analytics as new campaigns programs are developed for partners provide recommended strategies supported by analytics design develop and maintain predictive and segmentation models including data acquisition testing validation deployment and refinement of these models utilize machine learning and other advanced data tools to solve business problems what do you need to succeed must have curious mind with a desire to solve problems with data strong analytical skills with the ability to interpret complex data and make data based strategic decisions solid technical skills with expertise with statistical analysis sql r python machine learning and data visualization tools understanding and experience building segmentation and predictive models strong interpersonal skills with ability to make and defend recommendations including creatively finding solutions to address multiple stakeholder needs ability to work under pressure focus on priorities and multi task independent self directed comfortable dealing with incomplete information uncertainty and change nice to have experience and success in both small startup environments and large matrix organizations experience with a sided marketplace for example merchants and consumers what s in it for you we are building something completely new in a dynamically changing industry it s never been done before you have the opportunity to leverage the significant resources of our business and brand to make that change happen in the real world a comprehensive total rewards program including bonuses and flexible benefits leaders who support your development through coaching and managing opportunities ability to make a difference and lasting impact work in an agile collaborative progressive and high performing team the opportunity to interface with senior level executives from many different parts of the organization rbcventures job summary city toronto address bay street th floor work hours week work environment office employment type permanent career level experienced hire professional pay type salary variable bonus position level pl required travel exempt non exempt n a people manager no application deadline req id ,rbc venture new kind organization one marries strength one world trusted successful financial institution mission reimagine role play people life building world class team focused creating new experience exploring new business model developing new relationship add value people live work opportunity creative thinker interested using data solve business problem working something completely new excite would like hear rbc reimaging role play client life creating dedicated reimagine team operate separately core banking business team operate completely agile environment able create new capability explore new business model develop partnership help differentiate rbc part process rbc partnered westjet bring brand new loyalty business called ampli canadian market rbc looking hire data analytics data scientist ampli work u build business role must comfortable wearing multiple hat focus building customer support structure delight member collaborate multiple teammate within operation function ensure proper control place right metric effectively tracked interaction ampli member base key component role form answering inquiry resolving issue bear responsibility actively managing data analytics pipeline within new business venture engage activity around product analytics build baseline analytics reporting across existing product feature help answer common general question define build complex sql query report new product feature drive value product roadmap development develop highly effective analytical product marketing segmentation churn analysis member profile deep dive etc enable business set strategic direction client profile partner analytics campaign monitoring work cross functionally strategic partnership team including merchant partner understand develop key metric partnership program expected partner including marketing roi contributable sale driven offer program marketing campaign obtain define data element deliver self serve dashboard within time requirement ongoing reporting package business development support modelling identify manage analyze interpret data support creation meaningful actionable insight tie directly internal external partner business objective provide analytic subject matter expertise define data driven client strategy including utilize experimental design post mortem analytics new campaign program developed partner provide recommended strategy supported analytics design develop maintain predictive segmentation model including data acquisition testing validation deployment refinement model utilize machine learning advanced data tool solve business problem need succeed must curious mind desire solve problem data strong analytical skill ability interpret complex data make data based strategic decision solid technical skill expertise statistical analysis sql r python machine learning data visualization tool understanding experience building segmentation predictive model strong interpersonal skill ability make defend recommendation including creatively finding solution address multiple stakeholder need ability work pressure focus priority multi task independent self directed comfortable dealing incomplete information uncertainty change nice experience success small startup environment large matrix organization experience sided marketplace example merchant consumer building something completely new dynamically changing industry never done opportunity leverage significant resource business brand make change happen real world comprehensive total reward program including bonus flexible benefit leader support development coaching managing opportunity ability make difference lasting impact work agile collaborative progressive high performing team opportunity interface senior level executive many different part organization rbcventures job summary city toronto address bay street th floor work hour week work environment office employment type permanent career level experienced hire professional pay type salary variable bonus position level pl required travel exempt non exempt n people manager application deadline req id 
